CV_ID,years_experience,highest_degree,skills,Job_Role,has_portfolio,raw_text,label
cv3414,3,Masters,"Regression, Speech Recognition, REST APIs, Docker, Kubernetes",Marketing Intern,FALSE,Junior intern with exposure to data labeling and manual data tasks.,0
cv3415,0,PhD,"HuggingFace, Reinforcement Learning, Tableau",Receptionist,FALSE,Recent graduate with coursework in statistics and interest in learning Python.,0
cv3416,4,Bachelors,"Python, GCP, Matplotlib, Feature Engineering",Content Writer,FALSE,Office assistant with administrative experience and basic computer skills.,0
cv3417,5,Bachelors,"Speech Recognition, EDA, OpenCV",Data Entry Operator,FALSE,"Marketing intern with experience in social media and campaign analytics, limited coding.",0
cv3418,3,Masters,"TensorFlow, Feature Engineering",Office Assistant,FALSE,"Marketing intern with experience in social media and campaign analytics, limited coding.",0
cv3419,2,Masters,"Deep Learning, Docker, FastAPI, GCP, Machine Learning, NumPy, Statistics, XGBoost",NLP Engineer,FALSE,"Computer vision engineer with experience in object detection, segmentation, and optimization.",1
cv3420,8,Bachelors,"Data Visualization, Reinforcement Learning, GCP, Matplotlib",Receptionist,FALSE,"Sales professional with strong communication skills, looking to transition to analytics.",0
cv3421,6,Bachelors,"AWS, CI/CD, Classification, Docker Compose, FastAPI, Hadoop, HuggingFace, JSON, Machine Learning, Pandas, SQLAlchemy, Seaborn, Spark, Statistics, Streamlit",Data Analyst,TRUE,"Experienced ML engineer with strong background in model development, deployment, and monitoring.",1
cv3422,2,Masters,"FastAPI, GPT, Machine Learning, Model Deployment, Hadoop",Customer Support,FALSE,"Receptionist experienced in communication and scheduling, no ML projects.",0
cv3423,8,Bachelors,"SQL, Pandas, Azure",Content Writer,TRUE,Entry-level candidate familiar with MS Excel and basic data entry tasks.,0
cv3424,4,Bachelors,"EDA, Docker, Matplotlib, Time Series",Content Writer,FALSE,Entry-level candidate familiar with MS Excel and basic data entry tasks.,0
cv3425,5,Bachelors,"Deep Learning, Clustering",Customer Support,FALSE,Recent graduate with coursework in statistics and interest in learning Python.,0
cv3426,5,Bachelors,"Data Engineering, GPT, JSON, Reinforcement Learning",Receptionist,FALSE,Recent graduate with coursework in statistics and interest in learning Python.,0
cv3427,6,Bachelors,"Linux, Signal Processing, SQL, Feature Engineering",Marketing Intern,FALSE,Junior intern with exposure to data labeling and manual data tasks.,0
cv3428,0,Bachelors,"Machine Learning, NumPy",Marketing Intern,FALSE,"Receptionist experienced in communication and scheduling, no ML projects.",0
cv3429,4,PhD,"CI/CD, Computer Vision, GPT, Kubernetes, Linux, Machine Learning, NumPy, Pandas, PyTorch, REST APIs, Scikit-learn, Spark, Speech Recognition, Streamlit",NLP Engineer,TRUE,Applied ML engineer experienced in productionizing deep learning models on cloud platforms.,1
cv3430,6,Bachelors,"BERT, Docker, FastAPI, Machine Learning, NumPy, Pandas, Power BI, SQL, Spark, XGBoost",Machine Learning Engineer,TRUE,"ML engineer experienced in MLOps, Docker, Kubernetes, and continuous deployment of models.",1
cv3431,1,Masters,"Streamlit, Feature Engineering, Reinforcement Learning, Spark, TensorFlow, BERT",Content Writer,FALSE,Customer support representative with some Excel skills and interest in analytics.,0
cv3432,8,Masters,"Docker Compose, Tableau",Sales Executive,FALSE,"Marketing intern with experience in social media and campaign analytics, limited coding.",0
cv3433,2,PhD,"Deep Learning, Time Series, Matplotlib, OpenCV",Customer Support,FALSE,"Receptionist experienced in communication and scheduling, no ML projects.",0
cv3434,0,PhD,"Azure, Machine Learning, EDA, Spark, GPT",Telecaller,FALSE,Business analyst with reporting experience but limited machine learning exposure.,0
cv3435,2,Bachelors,"Tableau, Scikit-learn, Speech Recognition",Data Entry Operator,FALSE,"Receptionist experienced in communication and scheduling, no ML projects.",0
cv3436,2,Bachelors,"Streamlit, Azure, Reinforcement Learning, TensorFlow, PyTorch",Receptionist,FALSE,"Marketing intern with experience in social media and campaign analytics, limited coding.",0
cv3437,8,Masters,"Clustering, Data Visualization, Machine Learning, NumPy, PyTorch Lightning, Python, Time Series",Computer Vision Engineer,TRUE,"Computer vision engineer with experience in object detection, segmentation, and optimization.",1
cv3438,8,PhD,"CI/CD, Classification, Computer Vision, Flask, NumPy, OpenCV, Python, Reinforcement Learning, Signal Processing, Statistics, Transformer Models",Senior Data Scientist,TRUE,"NLP specialist skilled in text preprocessing, fine-tuning transformer models, and evaluation.",1
cv3439,5,Masters,"REST APIs, Deep Learning, Time Series, GCP",Telecaller,FALSE,"Marketing intern with experience in social media and campaign analytics, limited coding.",0
cv3440,2,Masters,"Spark, EDA, Python, GCP",Customer Support,FALSE,Recent graduate with coursework in statistics and interest in learning Python.,0
cv3441,3,Masters,"Python, Clustering",Sales Executive,FALSE,Content creator interested in data science but lacks hands-on ML experience.,0
cv3442,7,Masters,"AWS, Deep Learning, Linux, Machine Learning, NumPy, PyTorch Lightning, Python, REST APIs, Spark",Data Scientist,TRUE,Research scientist with strong statistical background and experience publishing reproducible research.,1
cv3443,6,Bachelors,"GPT, FastAPI, Python",Administrative Assistant,FALSE,Business analyst with reporting experience but limited machine learning exposure.,0
cv3444,12,Bachelors,"AWS, Deep Learning, Docker, EDA, GCP, Kubernetes, Machine Learning, NumPy, Pandas, PyTorch, REST APIs",NLP Engineer,FALSE,Research scientist with strong statistical background and experience publishing reproducible research.,1
cv3445,1,Bachelors,"PyTorch Lightning, Python, Deep Learning",Junior Intern,FALSE,Entry-level candidate familiar with MS Excel and basic data entry tasks.,0
cv3446,3,Bachelors,"Feature Engineering, GPT, Model Deployment, NumPy, Pandas, PyTorch Lightning, Python, Streamlit, TensorFlow",Research Scientist,FALSE,"Experienced ML engineer with strong background in model development, deployment, and monitoring.",1
cv3447,1,Masters,"LightGBM, Azure, Time Series",Junior Intern,TRUE,Entry-level candidate familiar with MS Excel and basic data entry tasks.,0
cv3448,2,Bachelors,"Computer Vision, Linux, Docker, FastAPI, LightGBM",Administrative Assistant,FALSE,"Sales professional with strong communication skills, looking to transition to analytics.",0
cv3449,1,Masters,"Signal Processing, Feature Engineering, Transformer Models, Computer Vision",Telecaller,FALSE,Business analyst with reporting experience but limited machine learning exposure.,0
cv3450,1,PhD,"FastAPI, Model Deployment, NumPy, OpenCV, Pandas, Python, Signal Processing, Streamlit, XGBoost",ML Engineer,TRUE,Applied ML engineer experienced in productionizing deep learning models on cloud platforms.,1
cv3451,8,Masters,"Azure, Deep Learning, GPT, Machine Learning, NumPy, Python, Reinforcement Learning, Spark",Machine Learning Engineer,TRUE,"Data scientist with 4+ years in predictive modeling, feature engineering, and A/B testing.",1
cv3452,0,Bachelors,"Tableau, NLP, HuggingFace, Time Series, Hadoop",Data Entry Operator,TRUE,"Marketing intern with experience in social media and campaign analytics, limited coding.",0
cv3453,9,Bachelors,"Signal Processing, GCP, SQLAlchemy, Streamlit, Model Deployment, Reinforcement Learning",Marketing Intern,FALSE,"Receptionist experienced in communication and scheduling, no ML projects.",0
cv3454,12,Masters,"Computer Vision, Data Engineering, GPT, LightGBM, NumPy, Power BI, PyTorch Lightning, Python, REST APIs, Spark, Statistics",Research Scientist,TRUE,"Researcher focused on NLP and transformer-based models, with publications in top conferences.",1
cv3455,4,Bachelors,"Clustering, Spark, Pandas, AWS, EDA, OpenCV",Telecaller,TRUE,"Receptionist experienced in communication and scheduling, no ML projects.",0
cv3456,7,Masters,"Time Series, Classification",Telecaller,FALSE,Entry-level candidate familiar with MS Excel and basic data entry tasks.,0
cv3457,7,Masters,"Machine Learning, Seaborn, Python, Data Engineering",Receptionist,FALSE,Customer support representative with some Excel skills and interest in analytics.,0
cv3458,1,PhD,"Data Visualization, Docker, HuggingFace, LightGBM, Machine Learning, NLP, NumPy, SQLAlchemy, Scikit-learn, Signal Processing, Speech Recognition, Statistics, Streamlit",Data Scientist,TRUE,"Data scientist proficient in end-to-end ML pipelines, experimentation, and stakeholder communication.",1
cv3459,7,Bachelors,"GCP, PyTorch, LightGBM",Content Writer,FALSE,Recent graduate with coursework in statistics and interest in learning Python.,0
cv3460,3,Bachelors,"PyTorch, Statistics, Streamlit, Machine Learning, Classification",Telecaller,FALSE,Junior intern with exposure to data labeling and manual data tasks.,0
cv3461,1,Bachelors,"Docker, GCP, GPT, NumPy, Pandas, PyTorch Lightning, REST APIs, Signal Processing, Spark, Statistics, TensorFlow, Transformer Models",NLP Engineer,TRUE,Applied ML engineer experienced in productionizing deep learning models on cloud platforms.,1
cv3462,2,Bachelors,"Model Deployment, Git, EDA, GPT, Data Visualization, Flask",Administrative Assistant,FALSE,Junior intern with exposure to data labeling and manual data tasks.,0
cv3463,6,Masters,"Kubernetes, Python",Content Writer,FALSE,Recent graduate with coursework in statistics and interest in learning Python.,0
cv3464,0,Bachelors,"Streamlit, Speech Recognition, Python, Docker Compose, GCP, Azure",Customer Support,TRUE,Recent graduate with coursework in statistics and interest in learning Python.,0
cv3465,14,Masters,"CI/CD, Classification, Data Visualization, Docker Compose, JSON, Linux, Machine Learning, NLP, PyTorch Lightning, Python, Reinforcement Learning, Statistics",Senior Data Scientist,FALSE,"Experienced ML engineer with strong background in model development, deployment, and monitoring.",1
cv3466,8,Masters,"Azure, BERT, CI/CD, Computer Vision, Docker, Docker Compose, NumPy, Pandas, Power BI, Python",Applied ML Engineer,FALSE,"Data scientist with 4+ years in predictive modeling, feature engineering, and A/B testing.",1
cv3467,3,Masters,"Computer Vision, Deep Learning, EDA, Feature Engineering, GPT, Kubernetes, Model Deployment, NLP, NumPy, Pandas, Python, Reinforcement Learning, Statistics, XGBoost",Research Scientist,FALSE,"Computer vision engineer with experience in object detection, segmentation, and optimization.",1
cv3468,4,Masters,"CI/CD, Feature Engineering, Machine Learning, Matplotlib, NumPy, Python, Statistics",Machine Learning Engineer,FALSE,"Data scientist proficient in end-to-end ML pipelines, experimentation, and stakeholder communication.",1
cv3469,7,Bachelors,"Transformer Models, Docker, JSON",Content Writer,FALSE,"Receptionist experienced in communication and scheduling, no ML projects.",0
cv3470,9,Masters,"CI/CD, Deep Learning, NLP, NumPy, Pandas, Power BI, Seaborn, Statistics, XGBoost",Research Scientist,FALSE,"Researcher focused on NLP and transformer-based models, with publications in top conferences.",1
cv3471,2,Masters,"REST APIs, GCP, Tableau",Marketing Intern,FALSE,Content creator interested in data science but lacks hands-on ML experience.,0
cv3472,1,Masters,"BERT, Reinforcement Learning, Statistics, Git, Time Series",Sales Executive,FALSE,Customer support representative with some Excel skills and interest in analytics.,0
cv3473,8,Masters,"Azure, Data Engineering, Data Visualization, Machine Learning, NumPy, OpenCV, Python, Scikit-learn, Seaborn, Spark, Streamlit, Time Series",Senior Data Scientist,TRUE,"Data scientist proficient in end-to-end ML pipelines, experimentation, and stakeholder communication.",1
cv3474,6,Bachelors,"Streamlit, XGBoost, Speech Recognition, Computer Vision, Python, Docker Compose",Office Assistant,FALSE,Recent graduate with coursework in statistics and interest in learning Python.,0
cv3475,6,PhD,"Docker Compose, Git, HuggingFace, JSON, Linux, Pandas, Python, Statistics, Tableau",Computer Vision Engineer,TRUE,"Engineer skilled in time-series forecasting, anomaly detection, and feature engineering.",1
cv3476,1,Bachelors,"GCP, Computer Vision, PyTorch Lightning, Tableau, SQLAlchemy",Content Writer,FALSE,"Sales professional with strong communication skills, looking to transition to analytics.",0
cv3477,7,Masters,"Docker, GCP, Hadoop, HuggingFace, Linux, Machine Learning, NumPy, Pandas, Python, Regression, TensorFlow, XGBoost",Applied ML Engineer,FALSE,"Computer vision engineer with experience in object detection, segmentation, and optimization.",1
cv3478,6,PhD,"Computer Vision, EDA, GCP, GPT, Machine Learning, NumPy, PyTorch, Python, Spark",Machine Learning Engineer,TRUE,Research scientist with strong statistical background and experience publishing reproducible research.,1
cv3479,4,Masters,"Docker Compose, Matplotlib, Model Deployment, NumPy, OpenCV, Pandas, Python, Regression, Time Series",ML Engineer,FALSE,"Data scientist proficient in end-to-end ML pipelines, experimentation, and stakeholder communication.",1
cv3480,2,Masters,"Flask, Data Engineering, NLP, REST APIs",Marketing Intern,FALSE,"Marketing intern with experience in social media and campaign analytics, limited coding.",0
cv3481,0,Bachelors,"Transformer Models, Python, Matplotlib, Spark, LightGBM, Hadoop",Data Entry Operator,FALSE,Entry-level candidate familiar with MS Excel and basic data entry tasks.,0
cv3482,5,Bachelors,"Docker, LightGBM, Data Engineering, Classification, Model Deployment",Customer Support,FALSE,"Marketing intern with experience in social media and campaign analytics, limited coding.",0
cv3483,5,Bachelors,"Seaborn, Model Deployment, FastAPI",Marketing Intern,FALSE,"Receptionist experienced in communication and scheduling, no ML projects.",0
cv3484,5,Masters,"AWS, Python, REST APIs, CI/CD",Sales Executive,FALSE,Customer support representative with some Excel skills and interest in analytics.,0
cv3485,0,PhD,"Reinforcement Learning, Docker Compose",Receptionist,FALSE,Customer support representative with some Excel skills and interest in analytics.,0
cv3486,2,Masters,"BERT, JSON, OpenCV, Streamlit",Receptionist,FALSE,Entry-level candidate familiar with MS Excel and basic data entry tasks.,0
cv3487,1,Bachelors,"BERT, Pandas, SQLAlchemy, Docker Compose, Signal Processing, AWS",Sales Executive,FALSE,"Marketing intern with experience in social media and campaign analytics, limited coding.",0
cv3488,6,Bachelors,"Seaborn, Power BI, Deep Learning",Junior Intern,FALSE,"Sales professional with strong communication skills, looking to transition to analytics.",0
cv3489,6,Bachelors,"EDA, Git, Machine Learning, Model Deployment, OpenCV, Pandas, Python, REST APIs, Reinforcement Learning, SQL, Statistics",Applied ML Engineer,TRUE,"Data scientist proficient in end-to-end ML pipelines, experimentation, and stakeholder communication.",1
cv3490,4,Masters,"EDA, JSON, Pandas, Feature Engineering, Data Visualization, LightGBM",Junior Intern,FALSE,Junior intern with exposure to data labeling and manual data tasks.,0
cv3491,3,Bachelors,"CI/CD, GCP, Clustering",Receptionist,FALSE,Business analyst with reporting experience but limited machine learning exposure.,0
cv3492,4,Masters,"AWS, Docker, Machine Learning, Pandas, SQLAlchemy, Statistics, Streamlit, Transformer Models",Applied ML Engineer,TRUE,"ML engineer experienced in MLOps, Docker, Kubernetes, and continuous deployment of models.",1
cv3493,10,PhD,"Azure, Deep Learning, Docker Compose, Feature Engineering, Machine Learning, Matplotlib, NumPy, PyTorch Lightning, Python",AI Researcher,TRUE,"Data scientist with 4+ years in predictive modeling, feature engineering, and A/B testing.",1
cv3494,4,Masters,"GCP, Computer Vision, REST APIs, Signal Processing, Linux",Sales Executive,FALSE,Entry-level candidate familiar with MS Excel and basic data entry tasks.,0
cv3495,8,Bachelors,"Azure, CI/CD, Deep Learning, Feature Engineering, Flask, Hadoop, HuggingFace, NumPy, OpenCV, Pandas, Python, SQLAlchemy",AI Researcher,TRUE,"Data scientist with 4+ years in predictive modeling, feature engineering, and A/B testing.",1
cv3496,1,Bachelors,"SQL, NLP",Junior Intern,FALSE,"Receptionist experienced in communication and scheduling, no ML projects.",0
cv3497,5,Bachelors,"Data Visualization, GPT, Clustering",Sales Executive,FALSE,Customer support representative with some Excel skills and interest in analytics.,0
cv3498,9,PhD,"Git, OpenCV, TensorFlow, Reinforcement Learning, Statistics, Classification",Administrative Assistant,TRUE,Customer support representative with some Excel skills and interest in analytics.,0
cv3499,1,Bachelors,"EDA, Reinforcement Learning, Hadoop",Sales Executive,FALSE,Business analyst with reporting experience but limited machine learning exposure.,0
cv3500,12,PhD,"GPT, Linux, Matplotlib, NumPy, Pandas, Python, Scikit-learn, Signal Processing, Spark, Speech Recognition, Statistics",AI Researcher,FALSE,"Researcher focused on NLP and transformer-based models, with publications in top conferences.",1
cv3501,0,Masters,"Pandas, Streamlit, Docker, TensorFlow, CI/CD",Telecaller,FALSE,Junior intern with exposure to data labeling and manual data tasks.,0
cv3502,0,Bachelors,"Clustering, XGBoost",Content Writer,FALSE,Recent graduate with coursework in statistics and interest in learning Python.,0
cv3503,5,Bachelors,"Tableau, XGBoost",Telecaller,FALSE,Customer support representative with some Excel skills and interest in analytics.,0
cv3504,1,Bachelors,"Clustering, HuggingFace, Machine Learning, NumPy, OpenCV, Pandas, PyTorch, Regression, Seaborn, Speech Recognition, Tableau, TensorFlow",Senior Data Scientist,TRUE,Applied ML engineer experienced in productionizing deep learning models on cloud platforms.,1
cv3505,0,Bachelors,"Scikit-learn, Transformer Models, Speech Recognition, Kubernetes",Office Assistant,FALSE,Content creator interested in data science but lacks hands-on ML experience.,0
cv3506,4,Bachelors,"EDA, Signal Processing, JSON, SQL, GPT",Junior Intern,FALSE,Recent graduate with coursework in statistics and interest in learning Python.,0
cv3507,8,Bachelors,"Data Visualization, GPT, Kubernetes, Machine Learning, Power BI, Python, REST APIs, SQL, SQLAlchemy, Statistics, XGBoost",Computer Vision Engineer,FALSE,"Data scientist with 4+ years in predictive modeling, feature engineering, and A/B testing.",1
cv3508,7,Bachelors,"Classification, Data Visualization, Docker, Docker Compose, Flask, NumPy, Pandas, Signal Processing, Statistics, Time Series",Data Scientist,FALSE,"Data scientist with 4+ years in predictive modeling, feature engineering, and A/B testing.",1
cv3509,5,Masters,"Data Engineering, Flask, Machine Learning, Matplotlib, NumPy, Power BI, Python, Regression, Statistics, Tableau",Data Scientist,FALSE,Research scientist with strong statistical background and experience publishing reproducible research.,1
cv3510,9,PhD,"BERT, HuggingFace, Machine Learning, NumPy, PyTorch Lightning, Python, Scikit-learn, Seaborn, Speech Recognition, Streamlit, Time Series",ML Engineer,TRUE,"Experienced ML engineer with strong background in model development, deployment, and monitoring.",1
cv3511,12,Masters,"Classification, JSON, Machine Learning, Pandas, Scikit-learn, Spark, Speech Recognition, Statistics",Senior Data Scientist,FALSE,Research scientist with strong statistical background and experience publishing reproducible research.,1
cv3512,0,Bachelors,"Python, Data Visualization, Reinforcement Learning, LightGBM, EDA, Matplotlib",Administrative Assistant,FALSE,"Marketing intern with experience in social media and campaign analytics, limited coding.",0
cv3513,5,Bachelors,"Azure, CI/CD, Deep Learning, EDA, Flask, GPT, Machine Learning, Model Deployment, NumPy, Pandas, PyTorch Lightning, Reinforcement Learning, Tableau, Time Series",Data Analyst,TRUE,Research scientist with strong statistical background and experience publishing reproducible research.,1
cv3514,5,Masters,"AWS, Clustering, Docker, Hadoop, Machine Learning, NumPy, Pandas, REST APIs, Scikit-learn, Statistics, Streamlit, TensorFlow",Applied ML Engineer,FALSE,"Experienced ML engineer with strong background in model development, deployment, and monitoring.",1
cv3515,2,Bachelors,"Feature Engineering, Docker, BERT, TensorFlow, Time Series, CI/CD",Office Assistant,FALSE,Entry-level candidate familiar with MS Excel and basic data entry tasks.,0
cv3516,9,PhD,"Python, Deep Learning, Docker Compose, Speech Recognition",Sales Executive,FALSE,Business analyst with reporting experience but limited machine learning exposure.,0
cv3517,3,Masters,"Flask, Power BI, AWS, Speech Recognition, Spark, TensorFlow",Telecaller,TRUE,Office assistant with administrative experience and basic computer skills.,0
cv3518,9,Bachelors,"PyTorch, Docker Compose, Hadoop",Marketing Intern,FALSE,Entry-level candidate familiar with MS Excel and basic data entry tasks.,0
cv3519,0,Masters,"Model Deployment, NLP, AWS, SQLAlchemy, Signal Processing",Administrative Assistant,FALSE,"Receptionist experienced in communication and scheduling, no ML projects.",0
cv3520,3,Masters,"LightGBM, NLP",Receptionist,FALSE,Entry-level candidate familiar with MS Excel and basic data entry tasks.,0
cv3521,4,Masters,"BERT, Deep Learning, EDA, Git, NumPy, OpenCV, Pandas, Power BI, Seaborn, Spark, Statistics, TensorFlow, Transformer Models",Data Analyst,TRUE,Applied ML engineer experienced in productionizing deep learning models on cloud platforms.,1
cv3522,5,Bachelors,"LightGBM, Matplotlib, EDA, Time Series, OpenCV",Telecaller,FALSE,"Marketing intern with experience in social media and campaign analytics, limited coding.",0
cv3523,10,Masters,"HuggingFace, PyTorch, Data Visualization, Git, Tableau",Telecaller,TRUE,Entry-level candidate familiar with MS Excel and basic data entry tasks.,0
cv3524,3,Masters,"CI/CD, Docker Compose, Feature Engineering, Power BI, Signal Processing, HuggingFace",Data Entry Operator,FALSE,Content creator interested in data science but lacks hands-on ML experience.,0
cv3525,6,Bachelors,"Flask, TensorFlow",Customer Support,FALSE,Junior intern with exposure to data labeling and manual data tasks.,0
cv3526,7,PhD,"CI/CD, Clustering, Flask, Machine Learning, Pandas, REST APIs, Scikit-learn, Seaborn, Statistics, Tableau, Time Series",ML Engineer,FALSE,Research scientist with strong statistical background and experience publishing reproducible research.,1
cv3527,3,Masters,"Azure, Data Engineering, Deep Learning, Docker, Docker Compose, Hadoop, Linux, Machine Learning, Matplotlib, Pandas, Signal Processing, Statistics, Streamlit",Data Scientist,TRUE,"Engineer skilled in time-series forecasting, anomaly detection, and feature engineering.",1
cv3528,1,Bachelors,"Computer Vision, FastAPI, Speech Recognition, NumPy, Deep Learning, Azure",Content Writer,FALSE,Entry-level candidate familiar with MS Excel and basic data entry tasks.,0
cv3529,1,Bachelors,"OpenCV, Transformer Models, Reinforcement Learning",Junior Intern,FALSE,Entry-level candidate familiar with MS Excel and basic data entry tasks.,0
cv3530,10,Masters,"EDA, Feature Engineering, Hadoop, LightGBM, Linux, Machine Learning, Pandas, Python, Scikit-learn, Seaborn",AI Researcher,FALSE,"NLP specialist skilled in text preprocessing, fine-tuning transformer models, and evaluation.",1
cv3531,5,Bachelors,"GPT, PyTorch, Scikit-learn, Azure, Pandas",Customer Support,FALSE,Business analyst with reporting experience but limited machine learning exposure.,0
cv3532,3,PhD,"Azure, CI/CD, Classification, Docker Compose, EDA, Flask, HuggingFace, JSON, NumPy, Pandas, Power BI, Regression, Scikit-learn, Seaborn, Statistics",Machine Learning Engineer,TRUE,"ML engineer experienced in MLOps, Docker, Kubernetes, and continuous deployment of models.",1
cv3533,4,Bachelors,"Docker Compose, Hadoop",Junior Intern,FALSE,Junior intern with exposure to data labeling and manual data tasks.,0
cv3534,8,Bachelors,"Computer Vision, Feature Engineering, Flask, JSON, Kubernetes, Machine Learning, NLP, NumPy, REST APIs, Statistics, TensorFlow, XGBoost",Senior Data Scientist,TRUE,"Engineer skilled in time-series forecasting, anomaly detection, and feature engineering.",1
cv3535,8,Bachelors,"Docker, LightGBM, BERT, Classification",Telecaller,TRUE,Recent graduate with coursework in statistics and interest in learning Python.,0
cv3536,6,Masters,"Data Engineering, JSON, NumPy, Pandas, Python, Speech Recognition, Streamlit",AI Researcher,TRUE,"NLP specialist skilled in text preprocessing, fine-tuning transformer models, and evaluation.",1
cv3537,3,Masters,"Model Deployment, Pandas",Sales Executive,FALSE,Content creator interested in data science but lacks hands-on ML experience.,0
cv3538,8,Masters,"Transformer Models, Tableau, JSON",Office Assistant,FALSE,Customer support representative with some Excel skills and interest in analytics.,0
cv3539,9,Bachelors,"BERT, Classification, GCP, Hadoop, HuggingFace, Linux, NumPy, OpenCV, Pandas, PyTorch Lightning, Regression, Reinforcement Learning, Signal Processing, Statistics",Applied ML Engineer,FALSE,"Data scientist with 4+ years in predictive modeling, feature engineering, and A/B testing.",1
cv3540,7,Masters,"Azure, CI/CD, GPT, Pandas, Power BI, PyTorch Lightning, Python, Statistics, Tableau",Senior Data Scientist,FALSE,"Engineer skilled in time-series forecasting, anomaly detection, and feature engineering.",1
cv3541,3,Masters,"EDA, HuggingFace, Kubernetes, LightGBM, Machine Learning, NumPy, Pandas, Spark",Senior Data Scientist,TRUE,"Computer vision engineer with experience in object detection, segmentation, and optimization.",1
cv3542,5,Bachelors,"Computer Vision, PyTorch Lightning, XGBoost, FastAPI",Content Writer,FALSE,Recent graduate with coursework in statistics and interest in learning Python.,0
