CV_ID,years_experience,highest_degree,skills,Job_Role,has_portfolio,raw_text,label
cv1056,14,Masters,"CI/CD, Deep Learning, Docker Compose, EDA, GPT, Git, Hadoop, Machine Learning, PyTorch Lightning, Python, Statistics, Streamlit, Time Series",Data Analyst,TRUE,"Data scientist proficient in end-to-end ML pipelines, experimentation, and stakeholder communication.",1
cv1057,2,Bachelors,"BERT, Clustering, Docker Compose, Hadoop, HuggingFace, NumPy, Pandas, Python, Regression, Reinforcement Learning, SQLAlchemy",Senior Data Scientist,FALSE,"ML engineer experienced in MLOps, Docker, Kubernetes, and continuous deployment of models.",1
cv1058,2,Masters,"Transformer Models, Seaborn, Linux, Tableau",Receptionist,FALSE,Entry-level candidate familiar with MS Excel and basic data entry tasks.,0
cv1059,0,Masters,"Matplotlib, Feature Engineering, Model Deployment",Receptionist,FALSE,Content creator interested in data science but lacks hands-on ML experience.,0
cv1060,2,Masters,"Docker, Time Series, Tableau, Python, Model Deployment",Telecaller,FALSE,"Marketing intern with experience in social media and campaign analytics, limited coding.",0
cv1061,7,Bachelors,"Computer Vision, Data Visualization, Deep Learning, Flask, Git, HuggingFace, Linux, Machine Learning, Pandas, Python, REST APIs, Reinforcement Learning, Statistics, Transformer Models",Computer Vision Engineer,TRUE,"Computer vision engineer with experience in object detection, segmentation, and optimization.",1
cv1062,3,Masters,"Azure, Pandas, Tableau, FastAPI",Data Entry Operator,FALSE,Content creator interested in data science but lacks hands-on ML experience.,0
cv1063,5,Bachelors,"Docker Compose, Seaborn, Transformer Models",Marketing Intern,FALSE,Business analyst with reporting experience but limited machine learning exposure.,0
cv1064,5,Bachelors,"Data Visualization, Signal Processing, Statistics, SQL, FastAPI, JSON",Data Entry Operator,FALSE,"Marketing intern with experience in social media and campaign analytics, limited coding.",0
cv1065,1,Masters,"PyTorch Lightning, CI/CD",Customer Support,TRUE,Business analyst with reporting experience but limited machine learning exposure.,0
cv1066,5,Masters,"HuggingFace, Matplotlib",Customer Support,FALSE,"Sales professional with strong communication skills, looking to transition to analytics.",0
cv1067,8,PhD,"Data Engineering, GCP, Machine Learning, NumPy, Pandas, Power BI, Regression, SQLAlchemy, Scikit-learn, Seaborn, Statistics, Tableau",NLP Engineer,TRUE,Applied ML engineer experienced in productionizing deep learning models on cloud platforms.,1
cv1068,1,Masters,"CI/CD, SQLAlchemy, Regression, Azure, BERT, OpenCV",Sales Executive,FALSE,"Sales professional with strong communication skills, looking to transition to analytics.",0
cv1069,2,Bachelors,"LightGBM, Azure, Streamlit, NLP",Data Entry Operator,FALSE,Junior intern with exposure to data labeling and manual data tasks.,0
cv1070,0,Masters,"Flask, HuggingFace, Python, GCP, REST APIs, Feature Engineering",Office Assistant,TRUE,Customer support representative with some Excel skills and interest in analytics.,0
cv1071,0,Bachelors,"Hadoop, PyTorch",Administrative Assistant,FALSE,Office assistant with administrative experience and basic computer skills.,0
cv1072,8,Bachelors,"SQLAlchemy, Computer Vision, Data Visualization, JSON",Marketing Intern,FALSE,Junior intern with exposure to data labeling and manual data tasks.,0
cv1073,8,Bachelors,"Computer Vision, Pandas, REST APIs, PyTorch Lightning, Matplotlib",Receptionist,FALSE,Office assistant with administrative experience and basic computer skills.,0
cv1074,6,Bachelors,"AWS, Kubernetes, PyTorch Lightning, Clustering, Docker",Data Entry Operator,FALSE,Entry-level candidate familiar with MS Excel and basic data entry tasks.,0
cv1075,2,Bachelors,"GPT, AWS",Office Assistant,FALSE,Recent graduate with coursework in statistics and interest in learning Python.,0
cv1076,4,Bachelors,"Speech Recognition, OpenCV",Administrative Assistant,FALSE,"Marketing intern with experience in social media and campaign analytics, limited coding.",0
cv1077,10,Bachelors,"Machine Learning, Reinforcement Learning, REST APIs",Customer Support,FALSE,Business analyst with reporting experience but limited machine learning exposure.,0
cv1078,1,Masters,"Feature Engineering, Docker Compose",Telecaller,FALSE,Recent graduate with coursework in statistics and interest in learning Python.,0
cv1079,4,Bachelors,"OpenCV, Streamlit, Matplotlib",Junior Intern,TRUE,Junior intern with exposure to data labeling and manual data tasks.,0
cv1080,7,PhD,"Spark, TensorFlow, LightGBM",Data Entry Operator,FALSE,"Receptionist experienced in communication and scheduling, no ML projects.",0
cv1081,4,Bachelors,"Clustering, Power BI, Linux",Office Assistant,FALSE,Business analyst with reporting experience but limited machine learning exposure.,0
cv1082,6,Masters,"Azure, BERT, Clustering, Deep Learning, LightGBM, NumPy, OpenCV, Pandas, Power BI, Python, REST APIs, Speech Recognition, Statistics, Time Series, Transformer Models",Data Analyst,FALSE,"Researcher focused on NLP and transformer-based models, with publications in top conferences.",1
cv1083,0,Masters,"Deep Learning, Git, CI/CD",Content Writer,FALSE,Business analyst with reporting experience but limited machine learning exposure.,0
cv1084,2,Masters,"SQLAlchemy, Statistics, Machine Learning, Computer Vision, PyTorch Lightning, AWS",Receptionist,FALSE,"Sales professional with strong communication skills, looking to transition to analytics.",0
cv1085,1,Bachelors,"Azure, Speech Recognition, Machine Learning, Docker, FastAPI",Office Assistant,FALSE,"Sales professional with strong communication skills, looking to transition to analytics.",0
cv1086,2,Masters,"Matplotlib, Kubernetes, Git, Time Series",Data Entry Operator,FALSE,Customer support representative with some Excel skills and interest in analytics.,0
cv1087,10,Masters,"CI/CD, Deep Learning, Machine Learning, NLP, OpenCV, Python, REST APIs, Seaborn, Speech Recognition, Statistics, TensorFlow",AI Researcher,FALSE,"Data scientist proficient in end-to-end ML pipelines, experimentation, and stakeholder communication.",1
cv1088,1,Bachelors,"NLP, Docker Compose, Transformer Models, Docker, Regression",Data Entry Operator,FALSE,Office assistant with administrative experience and basic computer skills.,0
cv1089,10,Bachelors,"Classification, Clustering",Administrative Assistant,FALSE,"Receptionist experienced in communication and scheduling, no ML projects.",0
cv1090,3,Bachelors,"Clustering, LightGBM, Data Visualization, Hadoop",Sales Executive,TRUE,Recent graduate with coursework in statistics and interest in learning Python.,0
cv1091,6,Masters,"CI/CD, Classification, Deep Learning, Feature Engineering, GPT, Machine Learning, NumPy, OpenCV, Pandas, Python, Regression, SQL, Seaborn, Signal Processing",Data Analyst,TRUE,Applied ML engineer experienced in productionizing deep learning models on cloud platforms.,1
cv1092,1,Bachelors,"Docker Compose, Machine Learning, NLP, NumPy, OpenCV, Power BI, PyTorch, Speech Recognition, Statistics",Research Scientist,TRUE,"Computer vision engineer with experience in object detection, segmentation, and optimization.",1
cv1093,3,Masters,"Kubernetes, REST APIs, Flask, Data Engineering, Speech Recognition, Computer Vision",Sales Executive,FALSE,Business analyst with reporting experience but limited machine learning exposure.,0
cv1094,5,Masters,"Statistics, Docker Compose, SQL, Python, Matplotlib, Linux",Customer Support,TRUE,"Sales professional with strong communication skills, looking to transition to analytics.",0
cv1095,9,Bachelors,"Seaborn, LightGBM",Telecaller,FALSE,Office assistant with administrative experience and basic computer skills.,0
cv1096,2,Bachelors,"AWS, Scikit-learn, Speech Recognition, Python",Marketing Intern,FALSE,Junior intern with exposure to data labeling and manual data tasks.,0
cv1097,6,Bachelors,"TensorFlow, Matplotlib",Administrative Assistant,FALSE,Content creator interested in data science but lacks hands-on ML experience.,0
cv1098,0,Masters,"Power BI, Signal Processing, Docker Compose, Statistics",Marketing Intern,FALSE,Office assistant with administrative experience and basic computer skills.,0
cv1099,3,Masters,"JSON, Time Series, PyTorch Lightning, BERT, Signal Processing",Junior Intern,FALSE,Customer support representative with some Excel skills and interest in analytics.,0
cv1100,0,Bachelors,"AWS, OpenCV, Docker Compose, Linux, FastAPI",Administrative Assistant,TRUE,Recent graduate with coursework in statistics and interest in learning Python.,0
cv1101,5,Masters,"Statistics, Pandas, GCP, AWS",Administrative Assistant,FALSE,"Marketing intern with experience in social media and campaign analytics, limited coding.",0
cv1102,0,Bachelors,"Docker Compose, GPT",Customer Support,FALSE,Customer support representative with some Excel skills and interest in analytics.,0
cv1103,2,Masters,"Python, Speech Recognition, LightGBM, Regression, Azure",Marketing Intern,TRUE,Business analyst with reporting experience but limited machine learning exposure.,0
cv1104,5,Bachelors,"LightGBM, Docker Compose",Content Writer,FALSE,Recent graduate with coursework in statistics and interest in learning Python.,0
cv1105,5,Bachelors,"JSON, XGBoost, Machine Learning, Statistics, Transformer Models",Content Writer,FALSE,Junior intern with exposure to data labeling and manual data tasks.,0
cv1106,0,Masters,"Azure, NLP, Kubernetes",Sales Executive,FALSE,"Marketing intern with experience in social media and campaign analytics, limited coding.",0
cv1107,0,Masters,"Signal Processing, PyTorch",Sales Executive,FALSE,Customer support representative with some Excel skills and interest in analytics.,0
cv1108,5,PhD,"Git, Linux, Machine Learning, NLP, NumPy, OpenCV, PyTorch Lightning, Python, SQLAlchemy, Scikit-learn",NLP Engineer,FALSE,"ML engineer experienced in MLOps, Docker, Kubernetes, and continuous deployment of models.",1
cv1109,5,Masters,"Docker Compose, FastAPI, GPT, JSON, Machine Learning, Model Deployment, NumPy, OpenCV, Pandas, Python, Regression, Reinforcement Learning, Speech Recognition, Statistics, XGBoost",Machine Learning Engineer,TRUE,"Engineer skilled in time-series forecasting, anomaly detection, and feature engineering.",1
cv1110,5,Masters,"PyTorch, NLP, Flask, PyTorch Lightning, Linux, Data Engineering",Office Assistant,FALSE,Content creator interested in data science but lacks hands-on ML experience.,0
cv1111,9,Masters,"XGBoost, GCP, BERT, PyTorch, Speech Recognition",Junior Intern,FALSE,Customer support representative with some Excel skills and interest in analytics.,0
cv1112,5,Bachelors,"Seaborn, CI/CD, TensorFlow, Docker",Data Entry Operator,FALSE,Content creator interested in data science but lacks hands-on ML experience.,0
cv1113,5,Bachelors,"Speech Recognition, NLP, Seaborn, Python, AWS, Flask",Content Writer,TRUE,"Sales professional with strong communication skills, looking to transition to analytics.",0
cv1114,1,Masters,"Signal Processing, Scikit-learn, SQLAlchemy, GPT",Sales Executive,FALSE,Recent graduate with coursework in statistics and interest in learning Python.,0
cv1115,3,Bachelors,"Git, Flask",Sales Executive,FALSE,Business analyst with reporting experience but limited machine learning exposure.,0
cv1116,2,Masters,"Computer Vision, Deep Learning, Scikit-learn, PyTorch Lightning",Office Assistant,TRUE,"Receptionist experienced in communication and scheduling, no ML projects.",0
cv1117,1,Masters,"Scikit-learn, Clustering",Office Assistant,FALSE,Office assistant with administrative experience and basic computer skills.,0
cv1118,8,Bachelors,"Regression, Docker",Receptionist,FALSE,"Receptionist experienced in communication and scheduling, no ML projects.",0
cv1119,0,Bachelors,"Docker Compose, Power BI, Feature Engineering, Transformer Models",Telecaller,TRUE,Entry-level candidate familiar with MS Excel and basic data entry tasks.,0
cv1120,4,Bachelors,"Azure, Data Visualization, EDA, Hadoop, HuggingFace, Machine Learning, Matplotlib, Model Deployment, OpenCV, Pandas, PyTorch Lightning, Python, Reinforcement Learning",Applied ML Engineer,TRUE,"Researcher focused on NLP and transformer-based models, with publications in top conferences.",1
cv1121,1,Masters,"SQL, Regression, NumPy, Tableau",Customer Support,FALSE,Content creator interested in data science but lacks hands-on ML experience.,0
cv1122,0,Bachelors,"Feature Engineering, Git",Customer Support,FALSE,Entry-level candidate familiar with MS Excel and basic data entry tasks.,0
cv1123,10,Masters,"AWS, Classification, Data Visualization, Docker Compose, Feature Engineering, Hadoop, LightGBM, Machine Learning, NumPy, Pandas, Python, REST APIs, Statistics",Research Scientist,TRUE,Applied ML engineer experienced in productionizing deep learning models on cloud platforms.,1
cv1124,10,Bachelors,"BERT, Feature Engineering, Data Engineering, Spark, Model Deployment",Marketing Intern,FALSE,Customer support representative with some Excel skills and interest in analytics.,0
cv1125,1,Bachelors,"NLP, Flask, NumPy, Power BI, Machine Learning, TensorFlow",Content Writer,TRUE,"Receptionist experienced in communication and scheduling, no ML projects.",0
cv1126,1,Bachelors,"BERT, Classification, Clustering",Marketing Intern,FALSE,"Sales professional with strong communication skills, looking to transition to analytics.",0
cv1127,9,Bachelors,"Docker Compose, FastAPI",Administrative Assistant,FALSE,"Marketing intern with experience in social media and campaign analytics, limited coding.",0
cv1128,1,Bachelors,"XGBoost, Deep Learning, PyTorch Lightning",Customer Support,FALSE,Entry-level candidate familiar with MS Excel and basic data entry tasks.,0
cv1129,0,Bachelors,"Feature Engineering, Computer Vision",Administrative Assistant,FALSE,Entry-level candidate familiar with MS Excel and basic data entry tasks.,0
cv1130,5,Bachelors,"Model Deployment, Clustering, PyTorch Lightning, Statistics, Hadoop",Junior Intern,FALSE,Junior intern with exposure to data labeling and manual data tasks.,0
cv1131,8,PhD,"Data Engineering, Docker, HuggingFace, Machine Learning, Pandas, Power BI, Python",Computer Vision Engineer,TRUE,"ML engineer experienced in MLOps, Docker, Kubernetes, and continuous deployment of models.",1
cv1132,12,PhD,"Azure, Docker, Docker Compose, FastAPI, NumPy, Python, REST APIs, Reinforcement Learning, Signal Processing, Speech Recognition, Statistics, Streamlit",AI Researcher,TRUE,Applied ML engineer experienced in productionizing deep learning models on cloud platforms.,1
cv1133,1,Bachelors,"SQL, Git, PyTorch, Clustering, Azure, LightGBM",Data Entry Operator,FALSE,Office assistant with administrative experience and basic computer skills.,0
cv1134,8,Masters,"REST APIs, Data Engineering, GPT, Azure",Telecaller,FALSE,Office assistant with administrative experience and basic computer skills.,0
cv1135,10,Masters,"Hadoop, Linux, Machine Learning, Pandas, REST APIs, Reinforcement Learning, SQLAlchemy, Statistics, Tableau, TensorFlow",Computer Vision Engineer,TRUE,Applied ML engineer experienced in productionizing deep learning models on cloud platforms.,1
cv1136,6,Bachelors,"Hadoop, AWS, Statistics, Reinforcement Learning, Transformer Models",Content Writer,FALSE,"Marketing intern with experience in social media and campaign analytics, limited coding.",0
cv1137,0,Bachelors,"Time Series, EDA",Receptionist,FALSE,Office assistant with administrative experience and basic computer skills.,0
cv1138,0,Bachelors,"Classification, GCP, NLP",Customer Support,FALSE,Junior intern with exposure to data labeling and manual data tasks.,0
cv1139,3,Masters,"Classification, Hadoop, Machine Learning, NumPy, Pandas, Power BI, PyTorch, PyTorch Lightning, Python, REST APIs, Scikit-learn, TensorFlow, Time Series",Senior Data Scientist,FALSE,"NLP specialist skilled in text preprocessing, fine-tuning transformer models, and evaluation.",1
cv1140,0,Bachelors,"NLP, Computer Vision, Python, Regression, Linux",Content Writer,FALSE,Customer support representative with some Excel skills and interest in analytics.,0
cv1141,3,Bachelors,"Scikit-learn, JSON, SQL, Classification",Administrative Assistant,FALSE,"Receptionist experienced in communication and scheduling, no ML projects.",0
cv1142,5,Bachelors,"CI/CD, Streamlit",Data Entry Operator,TRUE,"Sales professional with strong communication skills, looking to transition to analytics.",0
cv1143,1,Masters,"TensorFlow, Classification, Power BI, Regression, GCP, Statistics",Receptionist,FALSE,Content creator interested in data science but lacks hands-on ML experience.,0
cv1144,8,Bachelors,"Azure, Data Engineering, Feature Engineering, Linux, Regression",Data Entry Operator,FALSE,Content creator interested in data science but lacks hands-on ML experience.,0
cv1145,8,Masters,"Flask, JSON, Matplotlib, NLP, NumPy, Pandas, Python, REST APIs, Tableau, Transformer Models",Data Scientist,FALSE,"Researcher focused on NLP and transformer-based models, with publications in top conferences.",1
cv1146,0,Masters,"NLP, JSON, Kubernetes",Administrative Assistant,FALSE,"Sales professional with strong communication skills, looking to transition to analytics.",0
cv1147,2,Masters,"Data Engineering, Data Visualization, Deep Learning, Machine Learning, NumPy, Pandas, PyTorch Lightning, Spark",Applied ML Engineer,TRUE,"ML engineer experienced in MLOps, Docker, Kubernetes, and continuous deployment of models.",1
cv1148,6,PhD,"Azure, NLP, NumPy, Pandas, SQLAlchemy, Statistics, XGBoost",Data Analyst,TRUE,"Data scientist with 4+ years in predictive modeling, feature engineering, and A/B testing.",1
cv1149,3,Masters,"Scikit-learn, Git, Azure, SQLAlchemy",Office Assistant,TRUE,"Marketing intern with experience in social media and campaign analytics, limited coding.",0
cv1150,0,Masters,"Hadoop, JSON, OpenCV",Receptionist,FALSE,"Sales professional with strong communication skills, looking to transition to analytics.",0
cv1151,10,Masters,"Data Engineering, Feature Engineering",Telecaller,FALSE,Business analyst with reporting experience but limited machine learning exposure.,0
cv1152,10,Masters,"SQLAlchemy, Docker Compose",Junior Intern,TRUE,Junior intern with exposure to data labeling and manual data tasks.,0
cv1153,3,Masters,"AWS, OpenCV, Transformer Models, CI/CD",Sales Executive,FALSE,"Sales professional with strong communication skills, looking to transition to analytics.",0
cv1154,1,Masters,"OpenCV, Classification, Clustering, Tableau, CI/CD",Content Writer,FALSE,"Receptionist experienced in communication and scheduling, no ML projects.",0
cv1155,6,Bachelors,"CI/CD, Deep Learning, Git, Linux, NumPy, OpenCV, Pandas, Python, Speech Recognition, Statistics",NLP Engineer,FALSE,"Experienced ML engineer with strong background in model development, deployment, and monitoring.",1
cv1156,5,Masters,"Data Engineering, GCP, Pandas, Power BI, PyTorch, Python, Scikit-learn, Statistics, Tableau, Transformer Models",AI Researcher,TRUE,"NLP specialist skilled in text preprocessing, fine-tuning transformer models, and evaluation.",1
cv1157,5,Masters,"Azure, CI/CD, Data Engineering, FastAPI, GPT, Git, Kubernetes, Machine Learning, NLP, NumPy, Pandas, Regression, Reinforcement Learning, Statistics, Streamlit",NLP Engineer,FALSE,"Experienced ML engineer with strong background in model development, deployment, and monitoring.",1
cv1158,8,Masters,"GPT, Python, Git, PyTorch, Speech Recognition, OpenCV",Administrative Assistant,FALSE,Content creator interested in data science but lacks hands-on ML experience.,0
cv1159,10,Masters,"Classification, Docker, GCP, LightGBM, Machine Learning, NLP, NumPy, PyTorch, Python, Reinforcement Learning, Speech Recognition, Statistics, Time Series, Transformer Models",Computer Vision Engineer,FALSE,"Researcher focused on NLP and transformer-based models, with publications in top conferences.",1
cv1160,8,Bachelors,"Flask, Git, LightGBM, Machine Learning, NumPy, OpenCV, Power BI, PyTorch Lightning, Python, Regression, Scikit-learn, Seaborn, Signal Processing, TensorFlow",Data Scientist,TRUE,Research scientist with strong statistical background and experience publishing reproducible research.,1
cv1161,7,Masters,"GPT, Scikit-learn, HuggingFace, SQLAlchemy, Signal Processing",Receptionist,FALSE,Business analyst with reporting experience but limited machine learning exposure.,0
cv1162,4,Bachelors,"Tableau, Git, Time Series, Signal Processing, Model Deployment, Streamlit",Content Writer,FALSE,"Sales professional with strong communication skills, looking to transition to analytics.",0
cv1163,3,Masters,"Data Engineering, Data Visualization, Flask, NumPy, Python, Regression, Signal Processing, Spark, Speech Recognition, Statistics",Data Scientist,FALSE,"Researcher focused on NLP and transformer-based models, with publications in top conferences.",1
cv1164,8,Bachelors,"EDA, Flask, Docker",Customer Support,FALSE,Customer support representative with some Excel skills and interest in analytics.,0
cv1165,7,Bachelors,"CI/CD, PyTorch Lightning, Pandas, XGBoost",Marketing Intern,FALSE,Business analyst with reporting experience but limited machine learning exposure.,0
cv1166,3,Masters,"Time Series, REST APIs, Data Visualization, NumPy, Clustering, Reinforcement Learning",Content Writer,TRUE,Content creator interested in data science but lacks hands-on ML experience.,0
cv1167,10,Masters,"NLP, FastAPI",Receptionist,FALSE,Content creator interested in data science but lacks hands-on ML experience.,0
cv1168,2,Masters,"Scikit-learn, Statistics, Model Deployment",Administrative Assistant,TRUE,"Receptionist experienced in communication and scheduling, no ML projects.",0
cv1169,7,Masters,"Spark, HuggingFace, Docker",Junior Intern,FALSE,Office assistant with administrative experience and basic computer skills.,0
cv1170,10,Bachelors,"Scikit-learn, Deep Learning, Computer Vision, Docker Compose, Classification",Telecaller,FALSE,"Receptionist experienced in communication and scheduling, no ML projects.",0
cv1171,10,Masters,"Docker, FastAPI, GPT, Machine Learning, Matplotlib, NumPy, Pandas, Python, Signal Processing, XGBoost",Computer Vision Engineer,FALSE,"Data scientist proficient in end-to-end ML pipelines, experimentation, and stakeholder communication.",1
cv1172,5,Bachelors,"Seaborn, HuggingFace",Administrative Assistant,FALSE,Customer support representative with some Excel skills and interest in analytics.,0
cv1173,5,PhD,"AWS, Data Engineering, FastAPI, Linux, Machine Learning, Model Deployment, NumPy, Pandas, Power BI, Spark, Statistics, Streamlit, Tableau, Transformer Models",Applied ML Engineer,TRUE,"Computer vision engineer with experience in object detection, segmentation, and optimization.",1
cv1174,0,Masters,"Signal Processing, FastAPI",Office Assistant,TRUE,Business analyst with reporting experience but limited machine learning exposure.,0
cv1175,1,Bachelors,"Git, REST APIs, Flask, Time Series",Marketing Intern,FALSE,"Receptionist experienced in communication and scheduling, no ML projects.",0
cv1176,7,Bachelors,"Git, Deep Learning, Computer Vision",Office Assistant,FALSE,Junior intern with exposure to data labeling and manual data tasks.,0
cv1177,3,Bachelors,"PyTorch, GPT, Docker Compose",Sales Executive,FALSE,"Receptionist experienced in communication and scheduling, no ML projects.",0
cv1178,5,Bachelors,"PyTorch, Model Deployment, HuggingFace, Tableau",Junior Intern,FALSE,Recent graduate with coursework in statistics and interest in learning Python.,0
cv1179,0,Bachelors,"Streamlit, AWS, Deep Learning, OpenCV, Power BI, Python",Receptionist,FALSE,"Sales professional with strong communication skills, looking to transition to analytics.",0
cv1180,3,Bachelors,"Statistics, Flask",Sales Executive,FALSE,Office assistant with administrative experience and basic computer skills.,0
cv1181,6,Masters,"AWS, CI/CD, Computer Vision, Machine Learning, Model Deployment, Pandas, PyTorch Lightning, Python, Time Series",Data Scientist,TRUE,"Computer vision engineer with experience in object detection, segmentation, and optimization.",1
cv1182,0,Bachelors,"Signal Processing, SQL, Hadoop, Linux, OpenCV",Customer Support,FALSE,Recent graduate with coursework in statistics and interest in learning Python.,0
cv1183,2,Masters,"Machine Learning, Linux",Administrative Assistant,FALSE,Office assistant with administrative experience and basic computer skills.,0
cv1184,7,Bachelors,"Regression, Linux, HuggingFace",Office Assistant,FALSE,Recent graduate with coursework in statistics and interest in learning Python.,0
cv1185,1,Masters,"Regression, CI/CD, Seaborn, Speech Recognition, EDA",Content Writer,FALSE,Recent graduate with coursework in statistics and interest in learning Python.,0
cv1186,0,Bachelors,"GPT, Power BI, Clustering, Reinforcement Learning, Computer Vision, EDA",Office Assistant,FALSE,Business analyst with reporting experience but limited machine learning exposure.,0
cv1187,3,Bachelors,"Matplotlib, TensorFlow, Docker, Machine Learning, Spark",Marketing Intern,TRUE,Junior intern with exposure to data labeling and manual data tasks.,0
cv1188,3,Bachelors,"Reinforcement Learning, Clustering, Azure, FastAPI, Scikit-learn",Sales Executive,FALSE,Office assistant with administrative experience and basic computer skills.,0
cv1189,7,Masters,"Time Series, Linux",Administrative Assistant,FALSE,"Receptionist experienced in communication and scheduling, no ML projects.",0
cv1190,4,Bachelors,"Power BI, Matplotlib, GPT, GCP, BERT, Azure",Marketing Intern,FALSE,"Sales professional with strong communication skills, looking to transition to analytics.",0
cv1191,3,Bachelors,"BERT, Spark, Reinforcement Learning, PyTorch, Tableau",Receptionist,FALSE,"Receptionist experienced in communication and scheduling, no ML projects.",0
cv1192,2,Bachelors,"PyTorch Lightning, Computer Vision, XGBoost, OpenCV, BERT",Office Assistant,FALSE,Customer support representative with some Excel skills and interest in analytics.,0
